cluster_id,num_posts,pain_point_summary
0,47,"Many developers struggle with building and deploying effective AI agents, particularly those requiring complex orchestration, efficient multi-agent communication, and robust handling of external APIs and tools.  Significant challenges include managing context across multiple agents, optimizing for speed and scalability in multi-agent systems, and overcoming limitations of free-tier access to necessary AI services.  A common need is for more autonomous agents capable of handling entire tasks without constant human intervention, including code generation, debugging, and testing."
1,57,"Developers struggle with AI coding assistants' limitations in handling large, complex projects and messy codebases, particularly concerning context management, efficient change tracking, and reliable performance across various codebases and languages.  The lack of a standardized, superior tool, coupled with inconsistent model performance and high costs, hinders productivity and efficient workflow.  Finding and evaluating the best tools for different needs and budgets also presents a significant challenge."
2,76,"Software developers are struggling to effectively integrate AI coding tools into their workflows, facing challenges with code quality, complexity handling, and understanding AI-generated code.  Concerns exist about over-reliance on AI leading to a decline in core coding skills and the potential for AI to replace human developers.  There's also a lack of readily available, high-quality resources and tools for AI-assisted coding, particularly free options."
3,67,"Users experience high costs and inconsistent performance across various AI coding assistants, including Gemini and Claude.  The lack of clear pricing transparency and frequent model updates lead to frustration and uncertainty about which tool offers the best value and reliability for complex coding tasks.  Integration challenges between different AI platforms and IDEs further complicate workflows and increase development time."
4,25,"Users report significant degradation in ChatGPT's coding capabilities, including frequent context loss, incomplete code generation, inaccurate outputs, and increased hallucination.  This decline in performance affects both free and paid users across various model versions, leading to frustration and a search for alternative AI coding tools.  The inconsistency and unreliability of ChatGPT's responses, especially in complex coding tasks, are major concerns."
5,45,"Users experience inconsistent performance and opaque pricing from AI coding assistants, particularly Cursor, leading to frustration with unpredictable costs and unreliable code generation.  The lack of transparency regarding token consumption and rate limits, coupled with frequent model downgrades and limitations, severely impacts user experience and trust.  This is further compounded by difficulties accessing desired models and a perceived lack of responsiveness from customer support."
6,75,"Developers struggle to effectively utilize LLMs for large-scale coding projects due to limitations in context window size and the inconsistent reliability of reasoning models across various LLMs.  This leads to challenges in maintaining context across multiple files, managing large codebases, and ensuring predictable, consistent outputs, especially for tasks requiring structured, step-by-step logic.  The need for efficient context management, reliable model selection, and improved error handling within the LLMs themselves is a major bottleneck."
7,57,"Users struggle to effectively manage workflows when using AI coding tools, leading to inconsistent code quality, project disorganization, and inefficient prompt engineering.  The lack of structured approaches and suitable tools for managing context,  debugging, and maintaining consistent coding styles across multiple AI interactions hinders productivity and adds significant overhead.  This results in frustration and wasted time, particularly for non-coders and those working on complex projects."
8,34,"The core pain point is the difficulty of managing the complexity of AI-assisted coding (""vibe coding""), particularly for mid-level and junior developers.  This complexity manifests in challenges with code maintainability,  security (especially access control), and the need for meticulous prompt engineering and code review to avoid errors and ensure production-ready results.  Scaling and maintaining larger projects built with this method proves especially problematic."
9,17,"Users need a streamlined way to manage and integrate various Model Context Protocol (MCP) servers into their workflows across different IDEs and LLMs.  The current landscape suffers from fragmentation, inconsistent configurations, and a lack of robust administration tools for managing access and logging across multiple servers and agents.  This leads to duplicated effort in setting up and maintaining context, and hinders efficient collaboration within teams using diverse development tools."
